Aircraft,Photo,Origin,Type,Versions,In Service,BVR kill chain,Associated products
F-22 Raptor,https://upload.wikimedia.org/wikipedia/commons/thumb/4/46/Lockheed_Martin_F-22A_Raptor_JSOH.jpg/1280px-Lockheed_Martin_F-22A_Raptor_JSOH.jpg,USA,Air Superiority Fighter,F-22A,183,"Stealth-dominant platform with supercruise, AN/APG-77 AESA radar, and internal AIM-120D/AIM-260 bays for 6+ BVR shots; enables cooperative engagement via Link-16; production capped at 195 total, with focus on upgrades for 2040s sustainment. AN/APG-77 Find/Fix supercruise; Tracks datalink; Targets AIM-260; Engage first-look; Assess stealth.","AN/APG-77(V)1 AESA radar, AIM-260 JATM, F119 engine"
F-35 Lightning II,https://upload.wikimedia.org/wikipedia/commons/thumb/4/43/First_F-35_headed_for_USAF_service.jpg/1280px-First_F-35_headed_for_USAF_service.jpg,USA,Multirole Stealth Fighter,F-35A/B/C,950,"CTOL/STOVL/Carrier variants with AN/APG-81 AESA, sensor fusion, and 4-6 internal BVR missiles; excels in distributed aperture targeting and MADL datalink for beyond-line-of-sight kills; rapid IOC expansion to 30+ squadrons by 2025. AN/APG-77(V)1 fusion Find; Tracks network; Targets AIM-120/260; Engage 5th gen; Assess sensor fusion.","AN/APG-77(V)1 AESA radar, AIM-260 JATM, F135 engine, EOTS-3 targeting"
F-15EX Eagle II,https://upload.wikimedia.org/wikipedia/commons/thumb/4/43/F-15EX_Eagle_II.jpg/1280px-F-15EX_Eagle_II.jpg,USA,Multirole Air Superiority Fighter,F-15EX,48,"New-build 4.5-gen with AN/APG-82(V)1 AESA, fly-by-wire, and 12+ external BVR missiles; bridges F-22/F-35 gap for high-volume fire; scaling to 129 total by 2030. AN/APG-82 Find/Fix large radar volume; Tracks multiple; Targets via EPAWSS EW; Engage AIM-120D-3; Assess datalink feedback.","AIM-120D-3 AMRAAM, AN/APG-82(V)1 AESA, EPAWSS EW system"
F/A-18E/F Super Hornet,https://upload.wikimedia.org/wikipedia/commons/thumb/9/9b/F-18E_Strike_Fighter_Squadron_115_%28VFA-115%29_flight_ops_CVN-72_2002-10-04.jpg/1280px-F-18E_Strike_Fighter_Squadron_115_%28VFA-115%29_flight_ops_CVN-72_2002-10-04.jpg,USA,Carrier-Based Multirole Fighter,"F/A-18E, F/A-18F",421,"Block III upgrades include AN/APG-79 AESA, IRST, and 10+ AIM-120 loads; vital for carrier BVR until F-35C maturity; fleet hit 12M flight hours in 2025, with SLM extending life to 10,000 hours. AN/APG-79(V)4 Find/Fix; Tracks AMRAAM; Targets EW protected; Engage BVR; Assess V4 upgrade.","AN/APG-79(V)4 AESA, AIM-120D-3 AMRAAM, AN/ALR-94 EW suite"
EA-18G Growler,https://upload.wikimedia.org/wikipedia/commons/thumb/f/fe/EA-18G_at_Whidbey_April_2007.jpg/1280px-EA-18G_at_Whidbey_April_2007.jpg,USA,Carrier-Based Electronic Warfare Aircraft,EA-18G,160,"ALQ-218/249 jammers suppress enemy radars for BVR ""permission to shoot""; integrates with F-35/F/A-18 via Link-16; full-rate production complete, supporting all 11 carrier air wings; fleet surpasses 12M flight hours. EW for Track protection; Fixes threats passively; Targets jamming; Engage supported; Assess F-22.","AN/APG-79(V)4 AESA, ALQ-218/249 jammers, Link-16"
F-16 Fighting Falcon,https://upload.wikimedia.org/wikipedia/commons/thumb/c/c9/F-16_June_2008.jpg/1280px-F-16_June_2008.jpg,USA,Multirole Fighter,"F-16C, F-16D",762,"Block 50/52+ with AN/APG-83 AESA, Sniper pod, and 6 AIM-120 pylons; cost-effective BVR filler during F-35 ramp-up; ~900 total but 762 combat-coded in 2025, with ongoing retirements and upgrades. AN/APG-83 Find/Fix; Tracks integrated; Targets AIM-120; Engage from pylons; Assess lightweight ops.","AN/APG-83 AESA, AIM-120D AMRAAM, Sniper pod"
E-3 Sentry,https://upload.wikimedia.org/wikipedia/commons/thumb/c/c5/E-3_Sentry_Airborne_Warning_and_Control_System_%28AWACS%29_conducts_a_mission.jpg/960px-E-3_Sentry_Airborne_Warning_and_Control_System_%28AWACS%29_conducts_a_mission.jpg,USA,Airborne Early Warning and Control,E-3G,31,"Rotodome-mounted AN/APY-2 radar for 360° surveillance out to 250+ nm, directing BVR intercepts and battle management via Link-16; 16-19 crew; Block 40/45 upgrades sustain fleet until E-7 transition in 2030s; 15 retirements planned. AN/APY-2 for Find/Fix distant; Tracks from AWACS; Targets selection networked; Engage directed; Assess battle management.","AN/APY-2 radar, Link-16, TF33 engines"
MQ-20 Avenger,https://upload.wikimedia.org/wikipedia/commons/thumb/0/0e/MQ-20_Avenger_2.jpg/1280px-MQ-20_Avenger_2.jpg,USA,Stealth Unmanned Combat Aerial Vehicle,MQ-20A,0,AESA nose for Find/Fix distant targets; Datalink Track from AWACS; Target selection networked; Engage AIM-120D-3 internally; Assess battle damage; ongoing AI autonomy tests in 2025 with Hivemind.,"AIM-120D-3 AMRAAM, AN/APG-82(V)1 AESA, F-15EX Eagle II"
XQ-58 Valkyrie,https://upload.wikimedia.org/wikipedia/commons/thumb/9/9a/XQ-58A_Valkyrie_01.jpg/1280px-XQ-58A_Valkyrie_01.jpg,USA,Low-Cost Attritable Collaborative Combat Aircraft,XQ-58A/B,0,"Low-cost attritable for Find in contested space; Tracks via datalink; Targets as decoy/launcher; Engage AIM-120D-3; Assess disposable; USMC program of record in 2025, 15-20 ready for 2026.","AIM-120D-3 AMRAAM, F-22 Raptor, AN/APG-77(V)1"
YFQ-42A Gambit,https://upload.wikimedia.org/wikipedia/commons/thumb/9/9d/XQ-67A_Off_Board_Sensing_Station_at_Gray_Butte_Field_Airport%2C_Palmdale%2C_California.jpg/1280px-XQ-67A_Off_Board_Sensing_Station_at_Gray_Butte_Field_Airport%2C_Palmdale%2C_California.jpg,USA,Collaborative Combat Aircraft,YFQ-42A (Gambit series),0,"Variant focuses on Find via low-cost sensors; Tracks in formation; Targets for suppression; Engage small BVR weapons; Assess attritable loss; first flight Aug 2025, second Nov 2025 under USAF CCA program.","AIM-120D AMRAAM, EPAWSS EW system, XQ-58A Valkyrie CCA"
YFQ-44A Fury,https://upload.wikimedia.org/wikipedia/commons/thumb/d/da/YFQ-44_ground_test.jpg/1280px-YFQ-44_ground_test.jpg,USA,Autonomous Air Vehicle / CCA,YFQ-44A,0,"F2T2EA: Find/Fix/Track via onboard AESA and networked datalinks from F-35; Target high-value threats; Engage with internal AIM-120D-3; Assess via swarm coordination; first flight Oct 31, 2025.","F-35 Lightning II, AIM-120D-3 AMRAAM, AN/APG-85 AESA"
Model 437 Vanguard,https://raw.githubusercontent.com/ayeeff/aircombat/main/data/Model%20437%20Vanguard.png,USA,Loyal Wingman / AI Testbed,Model 437,0,Attritable Find AESA; Tracks AIM-120; Targets low-cost; Engage internal; Assess wingman; flying as AI testbed since Sep 2025 under Northrop Beacon program for autonomy.,"AN/APG-77(V)1, AIM-120D-3 AMRAAM, F-22 Raptor"
