Aircraft,Photo,Origin,Type,Versions,In Service,Notes
F-22 Raptor,https://upload.wikimedia.org/wikipedia/commons/4/46/Lockheed_Martin_F-22A_Raptor_JSOH.jpg ,USA,Air Superiority Fighter,F-22A,183,"Stealth-dominant platform with supercruise, AN/APG-77 AESA radar, and internal AIM-120D/AIM-260 bays for 6+ BVR shots; enables cooperative engagement via Link-16; production capped at 195 total, with focus on upgrades for 2040s sustainment."
F-35 Lightning II,https://upload.wikimedia.org/wikipedia/commons/4/43/First_F-35_headed_for_USAF_service.jpg ,USA,Multirole Stealth Fighter,F-35A,302,"CTOL variant with AN/APG-81 AESA, sensor fusion, and 4-6 internal BVR missiles; excels in distributed aperture targeting and MADL datalink for beyond-line-of-sight kills; rapid IOC expansion to 12+ squadrons by 2025."
F-35 Lightning II,https://upload.wikimedia.org/wikipedia/commons/f/fc/F-35B_after_vertical_landing.jpg ,USA,STOVL Multirole Stealth Fighter,F-35B,183,"USMC STOVL variant for expeditionary ops; same BVR suite as F-35A but with short takeoff/vertical landing; supports 12 squadrons, replacing AV-8B for integrated Marine air-ground task forces."
F-35 Lightning II,https://upload.wikimedia.org/wikipedia/commons/f/fb/CF-1_flight_test.jpg ,USA,Carrier-Based Multirole Stealth Fighter,F-35C,67,"USN catobar variant with reinforced structure for carrier ops; 4 internal BVR missiles, EOTS-3 targeting; 67 delivered by end-2025 toward 273 total, enabling stealth carrier strike groups."
F-15EX Eagle II,https://upload.wikimedia.org/wikipedia/commons/3/3e/Boeing_F-15EX_Eagle_II_%28first_flight%29_2021_%28cropped%29.jpg ,USA,Multirole Air Superiority Fighter,F-15EX,24,"New-build 4.5-gen with AN/APG-82(V)1 AESA, fly-by-wire, and 12+ external BVR missiles; bridges F-22/F-35 gap for high-volume fire; 24 operational by late 2025, scaling to 144."
F/A-18E/F Super Hornet,https://upload.wikimedia.org/wikipedia/commons/9/9b/F-18E_Strike_Fighter_Squadron_115_%28VFA-115%29_flight_ops_CVN-72_2002-10-04.jpg ,USA,Carrier-Based Multirole Fighter,"F/A-18E, F/A-18F",421,"Block III upgrades include AN/APG-79 AESA, IRST, and 10+ AIM-120 loads; vital for carrier BVR until F-35C maturity; fleet hit 12M flight hours in 2025."
EA-18G Growler,https://upload.wikimedia.org/wikipedia/commons/f/fe/EA-18G_at_Whidbey_April_2007.jpg ,USA,Carrier-Based Electronic Warfare Aircraft,EA-18G,160,"ALQ-218/249 jammers suppress enemy radars for BVR ""permission to shoot""; integrates with F-35/F/A-18 via Link-16; full-rate production complete, supporting all 11 carrier air wings."
F-16 Fighting Falcon,https://upload.wikimedia.org/wikipedia/commons/c/c9/F-16_June_2008.jpg ,USA,Multirole Fighter,"F-16C, F-16D","762, 140","Block 50/52+ with AN/APG-83 AESA, Sniper pod, and 6 AIM-120 pylons; cost-effective BVR filler during F-35 ramp-up; ~900 total but 762 combat-coded in 2025."
